{"schema_version":"1.0","scenario_id":"f06-backlog-recovery-repaired","pair_id":"F06","variant":"repaired","seed":1106,"workload":{"aggregate_id":"obs-7","event_id":"evt-42","aggregate_version":3,"arrival_rate":120,"service_rate":180,"backlog":18000,"event_time":100,"processing_time":130},"initial_state":{"authority_version":2,"projection_version":1,"workflow_state":"validated"},"events":[{"tick":1,"type":"stop-consumer"},{"tick":2,"type":"grow-backlog"},{"tick":3,"type":"restart-consumer"}],"controls":{"atomic_outbox":true,"inbox_deduplication":true,"effect_idempotency":true,"enforce_versions":true,"quarantine_poison":true,"bounded_recovery":true,"durable_workflow":true,"late_data_policy":"correct","reconcile_derived":true},"expected":{"target_invariant":"I08","repaired_invariants":["I01","I02","I03","I04","I05","I06","I07","I08","I09","I10","I11","I12"]}}
